{
  "schema_version": "1.0",
  "operation_id": "operation-transcript-cut-001",
  "project_id": "project-demo-001",
  "revision_id": "revision-demo-001",
  "operation_type": "transcript_cut",
  "origin": "manual",
  "status": "applied",
  "created_at": "2026-09-27T12:00:00.000Z",
  "source_id": "source-screen-001",
  "transcript_id": "transcript-demo-001",
  "start_word_id": "word-00000001",
  "end_word_id": "word-00000002",
  "source_start_us": 200000,
  "source_end_us": 400000,
  "range": { "start_us": 200000, "end_us": 400000 },
  "reason": "Remove the explicitly selected transcript words from the draft.",
  "confidence": null,
  "evidence_ids": ["word-00000001", "word-00000002"],
  "before": { "duration_us": 1000000 },
  "after": { "duration_us": 800000 },
  "undo": { "restore_duration_us": 1000000 },
  "transaction_id": "transaction-transcript-cut-001"
}
