{
  "schema_version": "1.0",
  "operation_id": "operation-transcript-edit-001",
  "project_id": "project-demo-001",
  "revision_id": "revision-demo-001",
  "operation_type": "transcript_edit",
  "origin": "manual",
  "status": "applied",
  "created_at": "2026-09-27T12:00:00.000Z",
  "source_id": "source-screen-001",
  "transcript_id": "transcript-demo-001",
  "word_id": "word-00000001",
  "original_text": "teh",
  "before_text": "teh",
  "after_text": "the",
  "range": null,
  "reason": "Correct transcript text; recorded audio is unchanged.",
  "confidence": null,
  "evidence_ids": ["word-00000001"],
  "before": { "text": "teh" },
  "after": { "text": "the" },
  "undo": { "restore_text": "teh" },
  "transaction_id": "transaction-transcript-edit-001"
}
